<?xml version="1.0" encoding="UTF-8" standalone="no"?><summon xmlns:xsi="http://www.w3.org/2001/XMLSchema-instance" xsi:noNamespaceSchemaLocation="summon.xsd">
	<sid>bf69ec6f-8c86-4aec-abd4-508c288d93f9</sid>
	<vehno>SKK1100H</vehno>
	<carparkid>BIBE37</carparkid>
	<time>2012/04/03 14:22:25</time>
	<seasonpark/>
	<fineapplicable>N.A.</fineapplicable>
	<offence>18(1)</offence>
	<fineamt>NIL</fineamt>        
</summon>